{"schema_version":"0.1.0","object_type":"research_package_lineage_binding","research_package_id":"RP-NEW","research_package_digest":"sha256:dddddddddddddddddddddddddddddddddddddddddddddddddddddddddddddddd","source_lineage_ref":"LIN-EXP","source_lineage_digest":"sha256:205a924d9ae675e0135d2f0c382485ce0d66aa1c5cfbec8bc7410bc0e3d2a682","source_snapshot_ref":"SNAP-E-001","source_snapshot_digest":"sha256:bbbbbbbbbbbbbbbbbbbbbbbbbbbbbbbbbbbbbbbbbbbbbbbbbbbbbbbbbbbbbbbb","status_against_active_lineage":"current"}